title,descriptive_text,published,word_count,procedural_steps,notes
COSCO Introduces Groundbreaking Electric Containerships in China,"COSCO Introduces Groundbreaking Electric Containerships in China
Summary: China witnesses a significant leap in maritime innovation as COSCO Shipping takes a stride towards sustainability by deploying the largest battery-powered containerships to date. Built to operate along the Yangtze River, these vessels boast a revolutionary swappable battery system, negating the need for charging stops and enhancing efficiency in goods transport between Shanghai and Wuhan.
In a bold move towards sustainable maritime transport, China’s COSCO Shipping has ushered two electric containerships into service, positioning them as the most substantial electric vessels ever built. COSCO Shipping Green Water 01 and 02 represent a pivotal step in establishing an eco-friendly shipping network on the Yangtze River, which is pivotal to China’s domestic trade.
These innovative ships are each equipped with a remarkable battery capacity exceeding 50,000 kilowatt-hours, stored in standardized shipping containers for ease of exchange. This unique battery arrangement allows each vessel to carry up to 700 TEU (Twenty-foot Equivalent Units) without the immediate necessity for recharging. The design serves to avoid any disruptions caused by recharging cycles, ensuring that the vessels can complete entire journeys—a stretch of over 600 nautical miles—between Shanghai and Wuhan uninterrupted.
Embracing the potential of battery power, these containerships also signal a technological advancement with smart ship features, including integrated navigation and energy management systems which promise to optimize their operational capabilities.
Launching the production phase in March 2022, COSCO executed a swift construction timeline with the first steel cut in December, leading to the ships’ completion and subsequent launch within a year.
These pioneering vessels, each boasting a 10,000-tonnage, are components of China’s grand vision to foster a green and intelligent shipping route on the Yangtze by 2030. As COSCO Shipping Green Water 01 and 02 venture along their riverine route, they stand as a testament to China’s commitment to reducing the maritime industry’s environmental footprint and pioneering the transition to clean energy in global shipping.
FAQ Section on COSCO Shipping’s Electric Containerships
What has COSCO Shipping achieved in the realm of maritime innovation?
COSCO Shipping has introduced two electric containerships, COSCO Shipping Green Water 01 and 02, which are the largest battery-powered containerships to date. These vessels are specially designed to operate on the Yangtze River without the need for frequent charging stops.
Why are these vessels considered innovative?
The innovation lies in their substantial battery capacity that exceeds 50,000 kilowatt-hours, organized in swappable battery containers. This design allows the vessels to transport up to 700 TEUs and voyage over 600 nautical miles between Shanghai and Wuhan uninterrupted. Additionally, integrated smart ship features, such as navigation and energy management systems, enhance their operational capabilities.
What is the significance of the battery system used in these ships?
The battery system’s significance is two-fold: firstly, the use of standardized shipping containers for batteries simplifies the process of swapping them, eliminating the need for lengthy recharging periods. Secondly, the large battery capacity ensures that these electric containerships can cover long distances without recharging, thus maintaining the efficiency of goods transport along the Yangtze River.
How does this development contribute to sustainability in maritime transport?
These vessels represent a significant leap toward reducing the environmental footprint of the maritime industry by leveraging clean energy. By operating on battery power, COSCO Shipping’s containerships aim to establish a green shipping network and contribute to China’s vision of an eco-friendly and intelligent shipping route on the Yangtze River by 2030.
What smart features are included in these containerships?
The containerships are equipped with smart ship features that include advanced integrated systems for navigation and energy management. These technologies aim to optimize the operational efficiency of the vessels.
Can you detail the timeline for the production of these electric vessels?
The production phase began in March 2022, with the first steel cut occurring in December. COSCO Shipping managed to complete the construction and deployment of these containerships within a mere year.
How do these vessels align with China’s larger goals for shipping?
COSCO Shipping Green Water 01 and 02 are integral to China’s broader objective of building a green and intelligent shipping route on the Yangtze River by the year 2030. They showcase China’s dedication to leading the transition towards clean energy in the global shipping industry.
Definitions
– TEU (Twenty-foot Equivalent Unit): A measurement used to describe the capacity of container ships and terminals. It is based on the volume of a 20-foot-long (6.1 m) shipping container.
– Kilowatt-hour (kWh): A unit of energy equivalent to one kilowatt (1 kW) of power expended for one hour (1 h) of time. It is commonly used to measure electricity consumption.
– Nautical miles: A unit of distance used in maritime and aviation contexts, equal to approximately 1.1508 miles or 1.852 kilometers.
Related Links
–
COSCO Shipping – The official website of COSCO Shipping, a leading global maritime transport company.
Jerzy Lewandowski, a visionary in the realm of virtual reality and augmented reality technologies, has made significant contributions to the field with his pioneering research and innovative designs. His work primarily focuses on enhancing user experience and interaction within virtual environments, pushing the boundaries of immersive technology. Lewandowski’s groundbreaking projects have gained recognition for their ability to merge the digital and physical worlds, offering new possibilities in gaming, education, and professional training. His expertise and forward-thinking approach mark him as a key influencer in shaping the future of virtual and augmented reality applications.",2023-12-29T02:24:00.000+02:00,897,,
A Symphony of Colors: Creating a Butterfly-Friendly Garden | TheAmberPost,"Gardens have the remarkable ability to become vibrant ecosystems, attracting a multitude of visitors, each with its own role in the intricate dance of nature. Among these enchanting guests, butterflies emerge as ethereal performers, bringing beauty and grace to the garden. This article explores the art of creating a butterfly-friendly garden, where colors, scents, and thoughtful design harmonize to invite these delicate creatures into your outdoor haven. Understanding the Butterfly Habitat: - Plant Selection for Nectar Sources: Butterflies are drawn to a diverse range of nectar-rich flowers. Choose a variety of plants with different blooming periods to provide a continuous supply of food throughout the growing season. Favorites include butterfly bush (Buddleia), coneflowers (Echinacea), and bee balm (Monarda). - Host Plants for Caterpillars: To encourage the complete life cycle of butterflies, include host plants where females can lay eggs, and caterpillars can feed. Examples include milkweed for monarch butterflies, parsley for swallowtails, and fennel for black swallowtails. [Best Soil for Thanksgiving Cactus](https://thegardening.org/blog/best-soil-for-thanksgiving-cactus/) - Sun and Shelter: Butterflies are ectothermic, relying on external sources of heat to regulate their body temperature. Provide sunny spots in your garden where butterflies can bask in the sunlight. Additionally, include sheltered areas for them to rest during windy or inclement weather. Creating a Butterfly-Friendly Design: - Colorful Appeal: Butterflies are attracted to bright, vibrant colors. Plant flowers in shades of red, orange, yellow, and purple to capture their attention. Consider creating color-themed clusters to make your garden visually appealing to both humans and butterflies. - Layered Planting: Design your garden with different plant heights to create layers and diverse habitats. Taller plants can provide a windbreak, while lower-growing varieties offer resting spots and easy access to nectar. - Butterfly-Friendly Features: Incorporate features like shallow puddling stations, where butterflies can drink water and absorb essential minerals. Place flat stones in sunny areas to create warm basking spots for these sun-loving insects. Cultivating a Butterfly Oasis: - Avoid Pesticides: Pesticides can harm butterflies at various stages of their life cycle. Opt for natural pest control methods and avoid using chemical treatments that may harm these delicate visitors. [propagate wandering jew,](https://thegardening.org/blog/propagate-wandering-jew/) - Mulching Wisely: Use organic mulches to retain soil moisture and suppress weeds, but leave some areas of bare soil for puddling and basking spots. Avoid excessive mulching, which may limit access to the soil. - Encourage Community Involvement: Collaborate with neighbors and community members to create a network of butterfly-friendly gardens. This not only expands the available habitat but also contributes to the overall health of local butterfly populations. Butterfly-Friendly Plant Selection: - Milkweed (Asclepias): Essential for monarch butterflies, milkweed serves as a host plant for their caterpillars. It also provides nectar for a variety of other butterfly species. - Lantana (Lantana camara): Lantana produces clusters of small, brightly colored flowers that attract butterflies. It's a hardy plant that thrives in sunny locations. - Zinnia (Zinnia elegans): Zinnias are prolific bloomers with a wide range of colors, making them a favorite among butterflies. Their sturdy stems also provide excellent perches. Educational Opportunities: - Butterfly Gardening Workshops: Organize workshops or educational events in your community to share the joy of butterfly gardening. Provide information on plant selection, gardening practices, and the importance of creating butterfly habitats. - Informational Signage: Place informative signs in your garden to educate visitors about the different butterfly species that frequent your space, as well as the importance of conservation efforts. Conclusion: Creating a butterfly-friendly garden is not just about cultivating a beautiful outdoor space; it's a celebration of the delicate dance between nature and these winged wonders. By embracing the right plants, thoughtful design principles, and eco-friendly practices, you can transform your garden into a haven that not only nourishes the needs of butterflies but also inspires a deeper connection with the natural world. So, let the colors bloom, the scents waft, and the butterflies flutter, as your garden becomes a living canvas painted with the ephemeral beauty of these graceful creatures.",2023-12-28T21:42:00.000+02:00,660,,
"Analysts Pick Top Three Coins for Solana-Like Gains in 2024 — Bitcoin, Meme Moguls, and Stacks","Solana is one the best altcoins in the crypto space as it has rallied over 600% from its December 2022 low. Did you miss out on Solana? Don't worry. Analysts have picked three coins that can give such massive gains in 2024. They are Bitcoin, Meme Moguls, and Stacks.
Analysts Forecast Bitcoin (BTC) Prices for 2024 Crypto Rover, a crypto analyst with over 615k followers on X, has hopped in on Bitcoin price prediction. The analyst noted that Bitcoin faces a major resistance at $44,300.
If Bitcoin price can surpass this resistance level, Crypto Rover noted that the coin would rise to $46,000. Also, another analyst, Michael Van de Poppe, has tagged Bitcoin ETF approval as a significant event for the flagship cryptocurrency.
Meanwhile, Matrix Port has forecasted that the US SEC will greenlight Bitcoin ETF in January 2024. The crypto company stated that this would be a major rally, taking Bitcoin to $50,000 by February 2024.
Meanwhile, Bitcoin has fluctuated between $40,766.45 and $44,155.79 in the past week. The bulls are currently gearing up to retest the $44,300 level. A breakout would spark a rally to $46,000.
Stacks (STX) Soars After Praises From Legendary Investor Tim Draper Stacks (STX), the native token of the Stacks Network, saw a 27% increase in value on Wednesday. This uptick followed a series of encouraging remarks from Tim Draper . Draper, while in an interview with CoinBureau, expressed his enthusiasm: ""I'm pretty excited about Stacks.""
Meanwhile, 2023 has seen a notable one for Stacks, especially with the launch of Bitcoin-based NFT projects like Ordinals. According to data from DeFiLlama, the amount of capital locked in Stacks has grown from $7 million to $50 million since the start of 2023.
Also, the Stacks price has increased 131.4% in the past months as it trades at the $1.4 region. Analysts have predicted a rise to $3 in 2024.
Why Meme Moguls (MGLS) Could Soar 50x in 2024 Besides Bitcoin and Stacks, analysts are also bullish on the blockchain ICO, Meme Moguls . Currently, Meme Moguls' tokens are valued at only $0.0025. Meanwhile, analysts have predicted a 50x price surge in 2024. Below are five reasons why Meme Moguls would soar in 2024:
Meme Moguls stands out with its innovative features in the gaming and financial market:
Unique Play-to-Earn Model: Meme Moguls introduces a play-to-earn concept where players can play games and earn real rewards. Analysts believe this approach could draw a broad audience interested in gaming and finance. Community-Driven Environment: The DeFi project focuses on community engagement. It provides a space for players to interact, compete, and grow together. Enhanced Gaming with NFTs: The platform's NFTs are more than collectibles. Their rarity and utility bring added value to the game's economy. Educational and Competitive Gameplay: The platform offers trading education beyond entertainment. The DeFi project hosts trading competitions, helping players develop their skills and strive to become top traders in the game. The MGLS token is the in-game currency and is a major part of this blockchain ICO. Players can use it to purchase assets and engage in game trading activities. Because of the uniqueness of the ecosystem, analysts have backed MGLS for a major surge in 2024.
Conclusion According to analysts, Bitcoin, Stacks, and Meme Moguls are among the best altcoins to give Solana-like price gains in 2024. Meanwhile, Meme Moguls is the cheapest of the three. It should be a top choice for investors looking for relatively cheap tokens with huge potential.
Learn more about the $MGLS here:
Visit Meme Moguls | Join the Community
Disclaimer: This is a paid press release, BSC.News does not endorse and is not responsible for or liable for any content, accuracy, quality, advertising, products, or other materials on this page. The project team has purchased this advertisement article for $560. Readers should do their own research before taking any actions related to the company. BSC.News is not responsible, directly or indirectly, for any damage or loss caused or alleged to be caused by or in connection with the use of or reliance on any content, goods, or services mentioned in the press release.",2023-12-28T02:00:00.000+02:00,686,,
MSN,"A New Rival for Shiba Inu: Rising Cryptocurrency Hits Over $1 Million, Capturing Investors' Focus December 28th, 12PM December 28th, 12PM --News Direct--
As
top altcoinslike Shiba Inu's SHIB continue to surge following whale activity, market analysts are looking for other top projects
to recommend to investors. As a result, they have identified one of the
new ICOs:
Rebel Satoshi,because of its impressive presale performance so far. Let's get the latest from the experts on these two projects.
Summary
Top ICOinvestors are rushing to
Rebel Satoshi ($RBLZ)after the
cryptocurrency ICOraised $1,000,000 in a few weeks.
The ongoing bull run could spur Shiba Inu (SHIB)
to $0.000018by January.
Shiba Inu Community Buzz: Analyzing Recent Developments and SHIB Forecast
Shiba Inu's community experienced a significant surge of positivity following a transaction involving a staggering
4 trillion SHIBcoins, amounting to a valuation of
$42 million. The detection of this transfer by
Whale Alerton December 9 sparked talks about heightened activity in Shiba Inu's ecosystem, capturing the attention of the crypto community.
This mammoth exchange of SHIB tokens occurred between wallets labeled as
""unknown,""intriguing observers as it didn't involve any typical exchange. This raised speculation about the nature of the transaction, prompting discussions on whether it was an
OTC tradeor a strategic move by a whale aiming to redistribute their SHIB holdings among various blockchain addresses.
Since the revelation of this transaction, SHIB has displayed an upward trend, ascending from $0. 8122 on November 28 to $0.00001083 on December 28, marking a noteworthy
33.64% increase. Bolstered by Shibarium's impressive developments, experts in the SHIB space have voiced their optimism, foreseeing a potential surge for SHIB to reach
$0.000018by January.
Amid these positive indicators, certain Shiba Inu analysts maintain a cautious stance due to SHIB's
historical price volatility. Expressing concerns about potential market fluctuations, they advocate prudence, warning of the likelihood of SHIB declining below
$0. 75by the culmination of 2023.
Rebel Satoshi: Redefining the
Blockchain ICOLandscape
Rebel Satoshihas swiftly risen as an electrifying force in the crypto arena, catching the eye of investors in pursuit of substantial returns and a redefined sense of decentralization. Its initial surge saw a staggering sale of
82 million $RBLZtokens since launching its public presale, raising over $1 Million and setting the stage for
Rebel Satoshi's promising trajectory.
Beyond its appearance as a meme coin project,
Rebel Satoshiembodies a larger movement advocating for engagement,
financial inclusivity, and a bold departure from established norms within the financial realm. It intertwines a playful interface with community solidarity, aiming to disrupt conventional paradigms prevalent in the crypto landscape.
At the core of
Rebel Satoshi lies the
$RBLZtoken, serving as both the project's governance and membership token. With a supply of
250 millioncoins and a
deflationary mechanismdriven by token burns, investors entering the
$RBLZecosystem unlock access to an array of offerings. This ecosystem includes a play-to-earn game, an NFT marketplace, zero buy or sell taxes, and a staking program, ensuring a holistic engagement for participants.
The public presale journey commenced with the
Early Bird Roundin November, offering
$RBLZat $0.010, which astoundingly sold out within a mere three weeks. Transitioning into Rebels Round 1, the value of
$RBLZsurged to $0.013, promising an encouraging
30% returnfor Early Bird Round participants. The growth has since continued.
Presently in
Citizens Round 3at $0.02, the earliest investors have already seen 100% increase on their initial investment. December heralds an enticing opportunity for
$RBLZinvestment. With prospects pointing toward a presale culmination at $0.025, Early Bird Round investors are positioned for a substantial
150% increasein their $RBLZ holdings, making the token one of the
best altcoins to invest in.
For the latest updates and more information, be sure to visit the official
Rebel Satoshi Presale Websiteor contact Rebel Red via
Telegram
Contact Details
Rebel Redz
Marketing@RebelSatoshi.com
View source version on newsdirect.com:
https://newsdirect.com/news/a-new-rival-for-shiba-inu-rising-cryptocurrency-hits-over-1-million-capturing-investors-focus-223086815",2023-12-28T17:53:00.000+02:00,632,,
Ancient Rock Carvings Mystery Revealed After Thousands Of Years,"Ancient Rock Carvings Mystery Revealed After Thousands Of Years
If you’ve ever been hiking in the mountainous regions of the United States, then you’ve probably come across ancient rock carvings fossilized in boulders strewn across the trails. While these petroglyphs are fun to come across while on an outdoor excursion, they can also tell us a lot about the ancient civilization that lived in these areas long, long ago. Recently, a study on petroglyphs carved into rocks in Colorado suggests that these spiral shapes could have been an ancient calendar used thousands of years ago.
Researchers from Jagiellonian University in Poland have made a groundbreaking discovery in the Castle Rock Pueblo settlement in Colorado. While archeologists believed they already knew so much about this area on the Colorado-Utah border, hints from locals suggested they climb higher into the mountains to possibly uncover something new. After exploring the higher, less accessible parts of the canyons, the team uncovered previously unknown ancient rock carvings, including spirals believed to be calendars.
Among the ancient carvings are spirals up to a meter in diameter believed to function as ancient calendars.
The recently revealed ancient carvings span approximately 4 kilometers and offer new insights into the lives of the ancient Pueblo people over 3,000 years ago.
Despite extensive prior studies involving excavations, geophysical surveying, and digitalization, archaeologists had not found these ancient carvings before. But thanks to the local community, researchers were able to discover the intricate lines, swirls, and designs etched into the rocky walls, about 800 meters above well-known settlements.
Among the ancient carvings are spirals up to a meter in diameter believed to function as ancient calendars. These carved symbols are thought to have played a role in marking special dates and tracking astronomical observations during the 3rd century CE Basketmaker Era. Radosław Palonka, an archaeologist involved on the team, remarked, “I used to think that we studied this area thoroughly, but these findings completely change our perception of the region.”
The newfound ancient rock carvings also challenge previous estimates of the population in the region during the 13th century.
During the Basketmaker Era, the Pueblo people inhabited semi-subterranean pit houses enclosed by wooden stockades, engaging in activities such as farming and crafting mats and baskets. Palonka emphasized the advanced nature of Pueblo culture, noting their mastery in constructing multi-story stone houses reminiscent of medieval townhouses or later blocks of flats.
Additionally, the Pueblo people were renowned for their intricate rock art (now turned into the ancient rock carvings we currently study), as well as ceramics adorned with diverse motifs painted using a black pigment on a white background.
The newfound ancient rock carvings also challenge previous estimates of the population in the region during the 13th century. The
researchers suggest that the presence of these calendars and other diagrams may indicate a larger population than previously believed. This revelation opens up a host of questions about the daily lives, societal structures, and cultural practices of the ancient Pueblo people.
Efforts are underway to map the area in greater detail using LIDAR (Light Detection and Ranging) technology. This advanced technique promises a resolution of 5-10 centimeters, enabling the identification of even finer details in the ancient carvings. Palonka expressed optimism about the ongoing work, anticipating the possibility of uncovering new, previously unknown sites, particularly from earlier periods.
Source:
Jagiellonian University",2023-12-29T01:00:00.000+02:00,558,,
