title,descriptive_text,published,word_count,procedural_steps,notes
PC Gamer Hardware Awards: The best motherboard of 2023,"PC Gamer PC Gamer Hardware Awards: The best motherboard of 2023 Read full article Dave James 28 December 2023 at 3:00 pm · 4-min read Best motherboard of the year.
The motherboard is one of the most integral pieces of the PC building puzzle because your choice of board answers a ton of questions for you before you even get started with anything else. It determines which processor generation and from which manufacturer you're going to be picking from, it determines what kind of storage you can choose, and it will have a huge impact on what your PC looks like.
And I don't even just mean in terms of form factor—though teeny mini-ITX mainboards all the way through to monstrous extended ATX mobos impact what size case you can build into—because your board can come as festooned with LEDs as any mechanical keyboard of the past decade. And have a ton of aRGB connections on them, too.
Though relative performance between different boards on the same chipset has almost entirely plateaued, there is still a huge amount of difference between motherboards in terms of feature set, memory support, and especially power componentry.
We've reviewed many different boards in the latest AMD and Intel chipsets this year, and a lot of them have been very good (if damned expensive), but only three have a chance to win its own PC Gamer Hardware Award. And the nominations are...
The best motherboard of 2023: the nominees ASRock Z790 Riptide WiFi
ASRock has come a long way in the past few years, creating a motherboard stack that encompasses everything from the very high-end to the very affordable. And with none of the cheapening out that we've maybe seen from the brand in times long gone.
This new Riptide board represents the top Intel chipset, ready and waiting for the latest 14th Gen chips, with a level of performance to allow them to hit their full potential.
It's also one of the few Z790 boards to really have a care for your storage concerns, with plenty of SATA ports and a full five M.2 sockets, too. It's feature set is strong, the performance right up at the top of the pile, and it's one of the best value Z790 motherboards you will ever find.
Story continues Read our full ASRock Z790 Riptide WiFi review .
ASRock B650E PG-ITX WiFi
It's tough not to find mini-ITX motherboards endlessly endearing. I mean, just look at this, it's soooo tiny. But judge me by my size, do you? This is another outstanding ASRock board and one that fully delivers as a modern motherboard for one of the latest AMD AM5 platforms.
The B650E is AMD's second tier Zen 4 chipset, and is a single chip solution, which is why you'll find more B650/E mini-ITX boards than B670/E versions in the smaller form factor. And yes, you are compromising by picking this tiny design, but not in any way that will really matter to the majority of PC gamers.
You still get one PCIe 5.0 socket in both x16 for graphics and x4 for M.2 SSDs, as well as a further PCIe 4.0 M.2 slot. It will also support up to DDR5-6800 memory and rocks a very impressive VRM. And just look at that back panel; this thing is stacked.
Read our full ASRock B650E PG-ITX WiFi review .
MSI MAG Z790 Tomahawk WiFi
It was always one of the more affordable Z790 boards when it first hit our test bench in January last year, but since the refreshed Z790s have hit the scene around the launch of the 14th Gen Intel chips its price has plummeted. It's now just $220, which for such a high-spec, high-end motherboard is rather cheap.
It's all about the core feature set over premium tier features that are more about marketing than anything a genuine PC gamer will use with their PC. And that makes them the sort of motherboard we'd be happy to stick in our own rigs.
But that doesn't mean sacrificing performance, not a jot. Nowadays pretty much all modern motherboards perform within a hair's breadth of each other in the benchmark stakes, which means it's all down to pricing and features, and the MSI Tomahawk is a contender on both counts.
Read our full MSI MAG Z790 Tomahawk WiFi .
The winner of the PC Gamer Hardware Award for the best motherboard will be announced on New Year's Eve. All three of these motherboards are in with a shot of taking home the big prize, so tune in to find out which one it'll be.
TRENDING Knife-wielding patient goes berserk at Sengkang hospital, gets six weeks in the slammer Coconuts Singapore · 2-min read Desaru Coast tragedy: Body of Singaporean man swept off by strong currents is found, 5km off drowning site Yahoo News Singapore · 2-min read Christmas food woes: Cold Storage apologises over undelivered and delayed orders, customers to be refunded Yahoo News Singapore · 3-min read Israeli embassy pulls video imagining Hamas attack in Seoul AFP News · 2-min read Li Chun 2024: When is the most auspicious time to deposit your money? Yahoo Lifestyle Singapore · 3-min read",2023-12-28T02:00:00.000+02:00,864,,
Solana's BONK Surpasses Shiba Inu and Dogecoin in Trading Volume,"- BONK, a memecoin on the Solana network, has experienced a significant price increase, with a 6700% surge since January, outperforming Solana (SOL) and Bitcoin (BTC). Despite this, it has faced corrections with a 14% drop in daily charts and over 40% in weekly charts. - After being listed on Coinbase, BONK’s trade volume crossed the $30 million mark, surpassing Dogecoin (DOGE) and Shiba Inu (SHIB) on the platform. However, its utility is questioned, and competitors like DOGE and SHIB continue to dominate the memecoin market. - CoinCodex predicts that BONK may consolidate around its current levels and could reach $0.00001487 by January 1, 2024. BONK’s price may also be influenced by Solana’s performance, as it saw a drop after hitting a yearly high but could potentially rise if SOL gains momentum or if a bull run occurs in 2024. “` In the cryptocurrency world, a new star has emerged in the form of BONK, a memecoin built on the Solana blockchain. After a period of dormancy throughout most of 2023, BONK has experienced an explosive increase in value recently. This surge is attributed to its inclusion on Coinbase, leading to trading volumes that have eclipsed those of well-known memecoins like Dogecoin and Shiba Inu, with transactions crossing the $30 million threshold on the platform. Recent Performance and Market Movements - BONK has shown a staggering 6700% price increase since January, outshining both its blockchain base, Solana, which rose nearly 1000%, and even Bitcoin, which saw a 160% rise. - Despite its significant ascent, BONK has undergone a sharp correction, dropping by more than 14% on the daily charts, over 40% weekly, and 12% over the last fortnight. - Still, BONK has maintained a 244.5% gain over the past month, showcasing its volatile yet robust performance. Market Predictions and Future Outlook - Market analysts are cautious about the future of BONK due to its limited utility and the dominance of other memecoins like Dogecoin and Shiba Inu in the sector. - CoinCodex forecasts a potential consolidation around the current price levels, projecting BONK could hit $0.00001487 by January 1, 2024. - The coin’s future movements could also be influenced by Solana’s performance, which has recently faltered but may boost BONK if it regains momentum. - There is also speculation that BONK could benefit from a potential cryptocurrency bull run in 2024. [CoinGecko](https://www.coingecko.com/en/coins/bonk)",2023-12-29T00:00:00.000+02:00,392,,
A Year in Stocks: What Worked and What Didn’t in 2023,"With just a couple of days left in the trading year, all the major markets are posting significant gains. At this time in 2022, not many investors would have taken that side of the bet. So, what lessons should investors take away after a volatile and unpredictable year in stocks? For starters, 2023 was a good reminder to invest in the market that is, not what you think it should be. To put that in terms that any parent with a teenager will understand: Trust but verify. At more than one point this past year, you would have believed a stock market crash not seen since 1929 was around the corner. Yet, every time, equities got off the mat, dusted themselves off and moved higher. And as the year comes to an end, there are billions, if not trillions of dollars re-entering the market. But are those dollars chasing overpriced stocks, or are they going after small-cap stocks with a lot of potential but no proven track record? And where should investors be thinking about putting their money in 2024? Here are some thoughts on the lessons a year in stocks can teach us. There’s a Reason Why Nvidia Is Just Getting Started Many investors aren’t sure what to make of the artificial intelligence ( [AI](https://investorplace.com/stock-quotes/ai-stock-quote/)) boom. On the one hand, to paraphrase writer Alan Saunders, AI is an example of life happening while we are busy making other plans. That is, we’ve known about AI for some time, yet the ChatGPT phenomenon made it impossible to ignore. The question is: Will it be friend or foe? Like all technological advances, it will likely be a little of both. As much as well-intentioned regulators will try, there will be bad actors with equally bad intentions. That’s troublesome. But on balance, AI will be transformative in how we interact with technology. And by we, I mean many who find today’s technology limiting. That means, like the internet, it’s a net win. That’s why companies are rushing to get in on AI. It’s not going to be a nice-to-have, it will be a must-have. And it’s also why companies like Nvidia (NASDAQ: [NVDA](https://investorplace.com/stock-quotes/nvda-stock-quote/)), Advanced Micro Devices (NASDAQ: [AMD](https://investorplace.com/stock-quotes/amd-stock-quote/)) and other [chip companies will flourish.](https://investorplace.com/2023/12/the-winners-and-losers-2023-stock-market-performance-review/) This is the beginning of a super cycle, and there’s still a lot of runway ahead. The Death of the Consumer Was (Mildly) Exaggerated Part of analyzing a year in stocks is identifying the best and worst sectors. At the beginning of the year, conventional wisdom was that consumer staples would do well and [consumer discretionary stocks](https://investorplace.com/industries/consumer-discretionary/) would struggle. In fact, the opposite occurred. Consumer staples have been the second-worst-performing sector. The companies performed well enough, but investors starving for growth [shifted to high-flying tech stocks.](https://www.fidelity.com/learning-center/trading-investing/outlook-consumer-staples) Meanwhile, consumer discretionary stocks are up nearly 20% as demand for travel and recreation remains strong. Is this demand being fueled by reckless spending that will come crashing down when the credit card bills come due? That’s been predicted for some time, and it hasn’t happened yet. The takeaway for investors is two-fold. One, don’t bet against the consumer. And two, be selective. Just because the consumer staples sector underperformed doesn’t mean there were no winners. Conversely, many consumer discretionary stocks really did face some tough times. Demand Delayed Is Not Demand Denied The energy sector did not perform as expected. For starters, the renewable energy movement is still struggling to get off the starting blocks. The solar sector is a good example of why even government subsidies can’t change the basics of supply and demand. The same could be said of electric vehicles. Yet, oil and gas stocks have been laggards as well. In September and October, crude oil prices near $100 were considered a certainty. But as the year comes to an end, crude oil is closer to $70. In both cases, investors should look at this as a case of demand delayed, not denied. In December, the Federal Reserve all but ensured interest rates would be cut in 2024, more than once — most likely. When that happens, oil demand will rise and, with it, the price of crude oil. An improving economy will also be a boost for renewable energy companies, which will benefit from [lower capital costs.](https://www.nytimes.com/2023/12/05/climate/renewable-energy-inflation-climate-cop28.html) On the date of publication, Chris Markoch did not hold (either directly or indirectly) any positions in the securities mentioned in this article. The opinions expressed in this article are those of the writer, subject to the InvestorPlace.com [Publishing Guidelines.](https://investorplace.com/corporate/investorplace-publishing-guidelines/)",2023-12-28T23:50:00.000+02:00,750,,
"Life Is Chill Expands Line of THC Soft Gels with New Live Resin THC Capsules, A First Of Its Kind for the Arizona Market | News | decaturdailydemocrat.com","The new plant-based soft gel will launch on Friday, January 19, providing Arizona consumers with a unique and innovative capsule option. Ally Biotech, dba Life Is Chill, a science-based provider of leading-edge bioactive delivery solutions for cannabinoids, today announces the launch of its live resin soft-gel capsules, ResinTime, under its Life Is Chill product line. The initial offering to the market is vegan-friendly, a new innovative soft gel based on a tapioca-starch and sugar-free product that addresses some of the dietary needs of consumers. The launch of live resin capsules marks a new era for soft gels in the Arizona market and will meet the increasing demand for products made from fresh-frozen cannabis. “Capsules are an increasingly popular choice for those seeking a smoke-free and sugar-free product, but the common practice of using gelatin in pills makes them inaccessible to people who prefer plant-based products or people that have allergies to bovine gelatin,” said Francis Baczek, President at Life Is Chill. “Our newest addition to the Chill Pill product line solves this problem with the additional benefit of high-quality live resin.” The ResinTime soft gels will officially launch on January 19th, 2024, at The Superior Dispensary in Phoenix. The vegan-friendly ResinTime is the company's newest addition to its current portfolio of easy-to-swallow THC soft-gel capsules, which includes six other variations: Day Caps, Night Caps, Anytime Caps, Anytime Hybrid+, Extreme Caps, and THCa Caps. “We are honored to kick off the launch of these live resin soft gels, a first of its kind in the Arizona market,” said Steve Shapiro, founder and CEO of The Superior Dispensary. “As a vegan, I’m excited to have a vegan-friendly product available for consumers. These capsules will provide another great option for customers seeking new ways to consume live resin-based products in an easily digestible way.” The award-winning soft gel brand is available in dozens of dispensaries across the state and has cemented itself as an Arizona staple for almost a decade. With the global cannabis capsule market expected to reach $108.14 billion by 2029, according to Data Bridge Market Research, and at least 6% of the American population identifying as either vegetarian or vegan, this new launch will meet the growing demand for dietary-friendly live resin products and provide an inhalation-free and sugar-free method of consumption for Arizona cannabis users. The new product launch follows Ally Biotech’s acquisition of the Chill Pill line in the spring of 2023. It continues the company’s plan to expand its product line and establish itself as a market leader in the soft gel category. For more information about the Chill Pill, visit Lifeischill.com. About Life Is Chill: The Arizona-based Life Is Chill brand is an expansive line of easy-to-swallow THC soft gels for the cannabis industry. Formulated using hemp seed oil, Chill Pills are sugar-free, easy to absorb and metabolize, and come in various strengths and strains, with effects ranging from highly responsive to highly relaxed. Life Is Chill is owned and operated by Ally Biotech, a company committed to harnessing the power of science to create innovative THC products. For more information, visit Lifeischill.com . About Ally Biotech: Headquartered in Payson, Arizona, Ally Biotech manufactures highly bioavailable products. The company’s Lipofusion® delivery technology combines nanotechnology and liposomal science to speed product differentiation and innovation. The company’s products undergo rigorous testing for purity, potency, safety, and efficacy at third-party laboratories. For more information, visit AllyBiotech.com . For more information about the Life Is Chill brand, please visit Lifeischill.com. View source version on businesswire.com: https://www.businesswire.com/news/home/20231228535540/en/ Contacts Sadie Thompson Proven Media 602-527-0794 [sadie@provenmediaservices.com](mailto:sadie@provenmediaservices.com)",2023-12-28T02:00:00.000+02:00,593,,
Web development company Things To Know Before You Buy,"Pleasure: We prioritize our customers’ fulfillment. That’s why our whole team, from our venture professionals to our Net designers, make investments the time to find out your company, solutions, and plans. It’s also why our client recommendation score is 488% increased than the industry normal.
These app developers are able to make articles management techniques that combine with present methods and supply scalable internet hosting packages so your app can improve without problems.
This enables For additional overall flexibility – possibly you already have a Consumer Interface, or have coding abilities but would really like anything designed. Furthermore, it drives charges down – application development as a result of these organizations is usually cheaper.
Some estimates for an Uber-like app go approximately $300,000. Within this guide, we stop working the price of application development to show you the place The cash goes.
Expert Technolabs continues to be serving the IT sector for the earlier 8 years. We have now over 200 pleased clients throughout the world. We've been happy to say that more than 70% of our customer ... read more about Expert Technolabs
Igor has actually been controlling Net design and development projects for the majority of of his 20-calendar year job. His technological, Imaginative and system competencies shine on every single smaller enterprise task he is effective on.
Take a look at Web site Subsequent an ironclad eyesight to create a World wide web planet that is
check here definitely beyond its technological elements, we began in a tempo of novices. Using a founder who has barely touched his late twenties and nonetheless provides a steadfast resolve, the vibe of Huptech’s workspace is a perfect combination of eccentricity and professionalism. An appr ... browse more about Huptech Internet Personal Constrained
Unless of course you ask for usually, your designer could also use inventory photographs (acquired from a 3rd party) as part of your design. If a designer makes use of stock artwork within a design, they’ll tell you which photos They may be and use watermarked variations of them within their entries.
As an example, will your most well-liked La app developer assist you just after launching the app and what’s their policy on publish-release bug fixing? Do they provide formal agreements or another thing? Receive the responses to those questions prior to heading any further.
As a specialist educator by working day, Ryan’s practical experience in education has helped him make a knack for online video and Picture storytelling. Ryan is usually reserving studio headshots and manufacturer pictures.
It is probably not obvious from an app developer’s web page what varieties of organisations they generally
more info operate with, so it’s vital that you talk to these queries specifically to ascertain how effectively they work along with your sort of small business.
From crafting and design to interactive movies and animations, Siege Media can assist firms of all sizes create most effective-in-course information that will get final results to the SERPs.
Our powerful targeting and filtering controls enable it to be quick to target the ideal sales opportunities for your business.
Learn how Turing crafted an iOS/Android/web practical experience for any investing platform, Placing a bunch of functions within the user’s fingertips.
Web development company Things To Know Before You Buy
Pleasure: We prioritize our customers’ fulfillment. That’s why our whole team, from our venture professionals to our Net designers, make investments the time to find out your company, solutions, and plans. It’s also why our client recommendation score is 488% increased than the industry normal.",2023-12-28T19:44:00.000+02:00,589,,
New species discovered at Bernheim Forest in Kentucky,"LOUISVILLE, Ky. — After years of possible sightings, an illusive species has finally been discovered to reside in an enormous forest, about 30 minutes outside of Louisville, Kentucky.
The nine-banded armadillo was recently confirmed as the newest species and 51st mammal in Bernheim Forest.
The discovery was verified by Bernheim staff when an armadillo was found on a roadside, unfortunately, hit and killed by a car.
According to an
announcement on the Bernheim Forest website, armadillos getting hit by cars is a common occurrence in areas with robust armadillo populations.
The scattered reports and this one individual confirmed animal suggest a small population exists within Bernheim.
""Be on the lookout during your next visit and you too might get a chance to see this southwestern armored creature,"" a Bernheim statement said.
Make it easy to keep up-to-date with more stories like this. Download the WHAS11 News app now. For
Apple or Android users.
Have a news tip? Email , visit our
Facebook page or Twitter feed.",2023-12-29T00:02:00.000+02:00,166,,
